Bus 007 Device 004: ID 1e71:2009 NZXT NZXT USB Device
Device Descriptor:
	bLength                18
	bDescriptorType         1
	bcdUSB               2.00
	bDeviceClass            0
	bDeviceSubClass         0
	bDeviceProtocol         0
	bMaxPacketSize0        64
	idVendor           0x1e71 NZXT
	idProduct          0x2009
	bcdDevice            2.00
	iManufacturer           1 NZXT. - Inc.
	iProduct                2 NZXT USB Device
	iSerial                 3 00000000001A
	bNumConfigurations      1
	Configuration Descriptor:
		bLength                 9
		bDescriptorType         2
		wTotalLength       0x0029
		bNumInterfaces          1
		bConfigurationValue     1
		iConfiguration          0
		bmAttributes         0xc0
			Self Powered
		MaxPower              100mA
		Interface Descriptor:
			bLength                 9
			bDescriptorType         4
			bInterfaceNumber        0
			bAlternateSetting       0
			bNumEndpoints           2
			bInterfaceClass         3 Human Interface Device
			bInterfaceSubClass      0
			bInterfaceProtocol      0
			iInterface              0
				HID Device Descriptor:
					bLength                 9
					bDescriptorType        33
					bcdHID               1.11
					bCountryCode            0 Not supported
					bNumDescriptors         1
					bDescriptorType        34 Report
					wDescriptorLength     463
				 Report Descriptors:
					 ** UNAVAILABLE **
			Endpoint Descriptor:
				bLength                 7
				bDescriptorType         5
				bEndpointAddress     0x81  EP 1 IN
				bmAttributes            3
					Transfer Type            Interrupt
					Synch Type               None
					Usage Type               Data
				wMaxPacketSize     0x0040  1x 64 bytes
				bInterval               1
			Endpoint Descriptor:
				bLength                 7
				bDescriptorType         5
				bEndpointAddress     0x01  EP 1 OUT
				bmAttributes            3
					Transfer Type            Interrupt
					Synch Type               None
					Usage Type               Data
				wMaxPacketSize     0x0040  1x 64 bytes
				bInterval               1
can't get device qualifier: Resource temporarily unavailable
can't get debug descriptor: Resource temporarily unavailable
Device Status:     0x0001
	Self Powered
