007:004:000:DESCRIPTOR         1623102750.453890
 06 00 FF 09 01 A1 01 85 10 09 01 15 00 26 FF 00
 75 08 95 3F B1 82 85 10 09 01 91 82 85 12 09 02
 15 00 26 FF 00 75 08 95 3F B1 82 85 12 09 02 91
 82 85 20 09 03 15 00 26 FF 00 75 08 95 3F B1 82
 85 20 09 03 91 82 85 22 09 04 15 00 26 FF 00 75
 08 95 3F B1 82 85 22 09 04 91 82 85 24 09 05 15
 00 26 FF 00 75 08 95 3F B1 82 85 24 09 05 91 82
 85 26 09 06 15 00 26 FF 00 75 08 95 3F B1 82 85
 26 09 06 91 82 85 28 09 07 15 00 26 FF 00 75 08
 95 3F B1 82 85 28 09 07 91 82 85 F2 09 08 15 00
 26 FF 00 75 08 95 3F B1 82 85 F2 09 08 91 82 85
 FE 09 09 15 00 26 FF 00 75 08 95 3F B1 82 85 FE
 09 09 91 82 85 FA 09 0A 15 00 26 FF 00 75 08 95
 3F B1 82 85 FA 09 0A 91 82 85 A2 09 0B 15 00 26
 FF 00 75 08 95 3F B1 82 85 A2 09 0B 91 82 85 60
 09 0C 15 00 26 FF 00 75 08 95 3F B1 82 85 60 09
 0C 91 82 85 62 09 0D 15 00 26 FF 00 75 08 95 3F
 B1 82 85 62 09 0D 91 82 85 66 09 0E 15 00 26 FF
 00 75 08 95 3F B1 82 85 66 09 0E 91 82 85 64 09
 0F 15 00 26 FF 00 75 08 95 3F B1 82 85 64 09 0F
 91 82 85 11 09 10 75 08 95 3F 81 82 85 13 09 11
 75 08 95 3F 81 82 85 21 09 12 75 08 95 3F 81 82
 85 23 09 13 75 08 95 3F 81 82 85 25 09 14 75 08
 95 3F 81 82 85 27 09 15 75 08 95 3F 81 82 85 29
 09 16 75 08 95 3F 81 82 85 FF 09 17 75 08 95 3F
 81 82 85 FB 09 18 75 08 95 3F 81 82 85 A3 09 19
 75 08 95 3F 81 82 85 61 09 1A 75 08 95 3F 81 82
 85 63 09 1B 75 08 95 3F 81 82 85 67 09 1C 75 08
 95 3F 81 82 85 65 09 1D 75 08 95 3F 81 82 C0

